smartctl 7.2 2020-12-30 r5155 [x86_64-linux-5.15.0] (local build)
Copyright (C) 2002-20, Bruce Allen, Christian Franke, www.smartmontools.org

=== START OF INFORMATION SECTION ===
Device Model:     Seagate ST2000DM001-1CH164
Serial Number:    Z1F12345
Firmware Version: CC24
User Capacity:    2,000,398,934,016 bytes [2.00 TB]
Sector Sizes:     512 bytes logical, 4096 bytes physical
Rotation Rate:    7200 rpm
Form Factor:      3.5 inches
SMART support is: Available - device has SMART capability.
SMART support is: Enabled

=== START OF READ SMART DATA SECTION ===
SMART Attributes Data Structure revision number: 10
Vendor Specific SMART Attributes with Thresholds:
ID# ATTRIBUTE_NAME          FLAG     VALUE WORST THRESH TYPE      UPDATED  WHEN_FAILED RAW_VALUE
  4 Start_Stop_Count        0x0032   100   100   000    Old_age   Always       -       1200
  5 Reallocated_Sector_Ct   0x0033   050   050   036    Pre-fail  Always       -       25
  9 Power_On_Hours          0x0032   020   020   000    Old_age   Always       -       55000
 12 Power_Cycle_Count       0x0032   099   099   000    Old_age   Always       -       1200
197 Current_Pending_Sector  0x0032   095   095   000    Old_age   Always       -       10
