smartctl 7.2 2020-12-30 r5155 [x86_64-linux-5.15.0] (local build)
Copyright (C) 2002-20, Bruce Allen, Christian Franke, www.smartmontools.org

=== START OF INFORMATION SECTION ===
Device Model:     Intel SSD 535 Series
Serial Number:    BTDA5123456789
Firmware Version: LF1i
User Capacity:    240,057,409,536 bytes [240 GB]
Sector Size:      512 bytes logical/physical
Rotation Rate:    Solid State Device
Form Factor:      2.5 inches
SMART support is: Available - device has SMART capability.
SMART support is: Enabled

=== START OF READ SMART DATA SECTION ===
SMART Attributes Data Structure revision number: 10
Vendor Specific SMART Attributes with Thresholds:
ID# ATTRIBUTE_NAME          FLAG     VALUE WORST THRESH TYPE      UPDATED  WHEN_FAILED RAW_VALUE
  9 Power_On_Hours          0x0032   099   099   000    Old_age   Always       -       25000
 12 Power_Cycle_Count       0x0032   099   099   000    Old_age   Always       -       800
177 Wear_Leveling_Count     0x0013   035   035   000    Pre-fail  Always       -       35
233 Media_Wearout_Indicator 0x0032   035   035   000    Old_age   Always       -       35
