smartctl 7.2 2020-12-30 r5155 [x86_64-linux-5.15.0] (local build)
Copyright (C) 2002-20, Bruce Allen, Christian Franke, www.smartmontools.org

=== START OF INFORMATION SECTION ===
Device Model:     WDC WD1003FZEX-00MK2A0
Serial Number:    WD-WMC1T0123456
User Capacity:    1,000,204,886,016 bytes [1.00 TB]
Rotation Rate:    7200 rpm
SMART support is: Available - device has SMART capability.
SMART support is: Enabled

=== START OF READ SMART DATA SECTION ===
SMART overall-health self-assessment test result: PASSED

SMART Attributes Data Structure revision number: 16
Vendor Specific SMART Attributes with Thresholds:
ID# ATTRIBUTE_NAME          FLAG     VALUE WORST THRESH TYPE      UPDATED  WHEN_FAILED RAW_VALUE
  5 Reallocated_Sector_Ct   0x0033   100   100   010    Pre-fail  Always       -       1
  9 Power_On_Hours          0x0032   099   099   000    Old_age   Always       -       15000
 10 Spin_Retry_Count        0x0013   100   100   097    Pre-fail  Always       -       0
 12 Power_Cycle_Count       0x0032   099   099   000    Old_age   Always       -       300
187 Reported_Uncorrect      0x0032   100   100   000    Old_age   Always       -       0
196 Reallocated_Event_Count 0x0032   100   100   000    Old_age   Always       -       0
197 Current_Pending_Sector  0x0032   100   100   000    Old_age   Always       -       0
198 Offline_Uncorrectable   0x0030   100   100   000    Old_age   Offline      -       0
199 UDMA_CRC_Error_Count    0x003e   100   100   000    Old_age   Always       -       0
