smartctl 7.2 2020-12-30 r5155 [x86_64-linux-5.15.0] (local build)
Copyright (C) 2002-20, Bruce Allen, Christian Franke, www.smartmontools.org

=== START OF INFORMATION SECTION ===
Device Model:     Seagate ST500DM002-1BD142
Serial Number:    W2A12345
User Capacity:    500,107,862,016 bytes [500 GB]
Rotation Rate:    7200 rpm
SMART support is: Available - device has SMART capability.
SMART support is: Enabled

=== START OF READ SMART DATA SECTION ===
SMART overall-health self-assessment test result: FAILED!
Drive failure expected in less than 24 hours. SAVE ALL DATA.

SMART Attributes Data Structure revision number: 10
Vendor Specific SMART Attributes with Thresholds:
ID# ATTRIBUTE_NAME          FLAG     VALUE WORST THRESH TYPE      UPDATED  WHEN_FAILED RAW_VALUE
  5 Reallocated_Sector_Ct   0x0033   010   010   036    Pre-fail  Always   FAILING_NOW 500
  9 Power_On_Hours          0x0032   010   010   000    Old_age   Always       -       60000
 12 Power_Cycle_Count       0x0032   099   099   000    Old_age   Always       -       1500
197 Current_Pending_Sector  0x0032   050   050   000    Old_age   Always       -       100
198 Offline_Uncorrectable   0x0030   050   050   000    Old_age   Offline      -       75
